Politician,Country,Language,Article_Link,Content
Andrzej Duda, Poland,en,https://en.wikipedia.org/wiki/Andrzej_Duda,"President of Poland since 2015

Andrzej Sebastian Duda[a] (born 16 May 1972) is a Polish lawyer and politician who has been the sixth and current president of Poland since 2015. Before becoming president, he served as Member of the Sejm (MP) from 2011 to 2014 and as Member of the European Parliament (MEP) from 2014 to 2015.

Duda was the presidential candidate for the Law and Justice party (PiS) during the presidential election in May 2015. In the first round of voting, he received 5,179,092 votes – 34.76% of valid votes. In the second round of voting, he received 51.55% of the vote, beating the incumbent president Bronisław Komorowski, who received 48.45% of the vote. On 26 May 2015, Duda resigned his party membership as the president-elect.

On 24 October 2019, he received the official support of PiS ahead of his re-election campaign in 2020. He finished first in the first round and then went on to defeat Rafał Trzaskowski in the runoff with 10,440,648 votes or 51.03% of the vote.[1] Throughout his first and second terms, Duda has largely aligned himself with the right-wing ideologies espoused by PiS and its leader Jarosław Kaczyński. Following the Russian invasion of Ukraine in February 2022, Duda has played an important role in coordinating international efforts to support Ukraine's military.[2]

Early life and education [ edit ]

Duda was born on 16 May 1972 in Kraków, to Janina (Milewska) and Jan Tadeusz Duda, professors at the AGH University of Science and Technology. His grandfather fought in the Polish–Soviet War and later was a member of the Home Army during the Second World War.[3]

Between 1987 and 1991, Duda attended Jan III Sobieski High School, Kraków, where he excelled in Humanities.[4] He subsequently studied law at the Jagiellonian University, and earned a law degree. In 2001, he was appointed as a research assistant in the Department of Administrative Law of the Jagiellonian University's Faculty of Law and Administration. In January 2005, Duda earned a Doctor of Law degree (LL.D.) at the Jagiellonian University. Due to his political career, he has been mostly on unpaid leave from the university since September 2006, except for a 13-month interval beginning in September 2010, when he returned to the university.[5] Additionally, he was a lecturer at Mieszko I College of Education and Administration, Poznań.[6]

Political career [ edit ]

President Lech Kaczyński appointing Duda as undersecretary of state in the Chancellery of the President, 16 January 2008

Duda began his political career with the now defunct Freedom Union Party in the early 2000s. After the parliamentary elections in 2005, he began his collaboration with the Law and Justice Party (PiS).[7] He was an undersecretary of state in the Ministry of Justice between 2006 and 2007 before becoming a member of Polish State Tribunal from 2007 until 2008.

From 2008 to 2010, during the presidency of Lech Kaczyński, Duda was an undersecretary of state in the Chancellery of the President.[8] In 2010, he was an unsuccessful candidate to become the Mayor of Kraków as a PiS candidate,[9] but was more successful in the 2011 parliamentary election, where he received 79,981 votes for the Kraków area, and thus became a member of the Sejm.[10]

In September 2013, the news magazine Polityka commended Duda for being one of the most active members of parliament, describing him as being open to opposition arguments and as refraining from personal attacks, as part of his role at the Commission for Constitutional Responsibility.[11] Duda remained a member of the Sejm until he was elected to the European Parliament in 2014.[12]

2015 presidential campaign [ edit ]

As Bronisław Komorowski's presidential term was expiring, Komorowski was able to seek re-election in a scheduled presidential election. Duda was Komorowski's Law and Justice rival in the election.

In the first round of the 2015 presidential election, Duda came first, receiving 5,179,092 votes and thus 34.76% of valid votes.[13]

In the second round Duda took 51.55% of the vote against the 48.45% share of his rival, the incumbent president Bronisław Komorowski.[14] On 26 May 2015, he officially resigned from party membership;[15] recent precedent calls for the president to not be a formal member of a political party.

2020 presidential campaign [ edit ]

In the first round of the 2020 presidential election, Duda appeared to come in first, receiving almost 44% of the votes. Warsaw mayor Rafał Trzaskowski came in second, with just over 30% of the vote. The second round took place on 12 July.[16] Duda won reelection.[17]

Presidency (2015–present) [ edit ]

Andrzej Duda taking the oath of office, 6 August 2015

Duda and Xi Jinping signed a declaration on strategic partnership

Duda with U.S. President Joe Biden in Warsaw

The first five-year term of Andrzej Duda began on 6 August 2015 with taking an oath of office during a National Assembly session.[18]

Duda rejected the European Union's proposal of migrant quotas to redistribute asylum seekers, saying: ""I won't agree to a dictate of the strong. I won't back a Europe where the economic advantage of the size of a population will be a reason to force solutions on other countries regardless of their national interests"".[19]

In September 2015 Prime Minister Ewa Kopacz declared that Poland, as an expression of ""European solidarity"", would take in 2,000 people over the next two years, mainly from Syria and Eritrea (out of 3,700 originally requested).[20]

Duda and Croatian President Kolinda Grabar-Kitarović were the originators of the Three Seas Initiative.[21]

Duda repeatedly met with general secretary of the Chinese Communist Party, Xi Jinping,[22][23] stating that ""Polish companies will benefit hugely"" from China's Belt and Road Initiative.[24] Duda and Xi signed a declaration on strategic partnership in which they reiterated that Poland and China viewed each other as long-term strategic partners.[25] Duda said that he hopes Poland will become a gateway to Europe for China.[26]

In September 2017, his approval rating stood at 71% and in February 2018, at 72%, a record surpassed only by Aleksander Kwaśniewski, whose approval ratings surpassed 75% from 1995 to 2005.[27][28]

On 6 June 2023, Duda presented three goals of Poland's presidency in the European Union in the first half of 2025. The first goal is to deepen transatlantic cooperation and strengthen the relationship between the European Union and the United States. The second goal is to further expand the community to include Ukraine, Moldova, and the Western Balkans, and in the future, other aspiring countries as well. The third goal will be to enhance Europe's energy security.[29]

In 2024, Duda criticised plans by Prime Minister Donald Tusk to suspend the right to asylum in Poland by irregular migrants, calling it a ""fatal mistake"" that would also affect dissidents from Russia and Belarus.[30]

Pardon of Mariusz Kamiński [ edit ]

In November 2015, on the basis of Article 139 of the Constitution of Poland, Duda pardoned former Central Anticorruption Bureau (CBA) head Mariusz Kamiński and three CBA officers convicted by a court of 1st instance in the so-called ""Land Affair"" [pl],[31] marking the first pardon granted by a president before reaching a final verdict. [32] According to some lawyers (including professors Jan Zimmermann – Andrzej Duda's doctorate promoter, Leszek Kubicki – former Minister of Justice and Andrzej Zoll – former president of the Constitutional Tribunal) Duda acted in violation of the Constitution of Poland.[33][34][35]

Constitutional crisis [ edit ]

Andrzej Duda during a meeting with the Council of Seniors of the Sejm and the Council of Seniors of the Senate at the Sejm

Andrzej Duda refused to swear in any of the five Constitutional Tribunal judge candidates selected by the Sejm of the VII term. Three of them had been selected since 7 November 2015 whose election was declared constitutional.[36] Between 3 and 9 December 2015, Duda swore in five other candidates for the same office selected by the Sejm of the VIII term.[37][38]

On 28 December 2015, Duda signed the Constitutional Tribunal bill (passed on 22 December 2015 by the Sejm), which unequivocally breaches the Constitution of Poland according to the National Council of the Judiciary of Poland,[39] the Public Prosecutor General[40] and the Polish Ombudsman.[41]

In July 2017, Duda informed the public he had decided to veto two controversial judicial bills backed by the government and passed by both houses of the Polish parliament. The President's spokesman subsequently said that the third act – the common courts bill – would be signed.[42] The veto was just one example of Duda opposing the policies of PiS.[43]

Politics of memory and the Holocaust [ edit ]

In February 2018, Duda said that he would sign into law the Amendment to the Act on the Institute of National Remembrance, making it illegal to accuse 'the Polish nation' of complicity in the Holocaust and other Nazi German atrocities, a measure that has roiled relations with Israel, with Prime Minister Benjamin Netanyahu going as far as accusing the Polish government of ""Holocaust denial"".[44][45][46]

In September 2022, Duda and his wife attended the funeral of Holocaust survivor Edward Mosberg in the United States, and Duda announced that he was awarding Mosberg the Grand Cross of the Order of Merit of the Republic of Poland, the highest Polish award in its class.[47] He awarded it in recognition of Mosberg's achievements in advancing Polish-Jewish dialogue and developing cooperation between nations, and for preserving the memory of and communicating what happened in the Holocaust.[47]

Stance on LGBT rights [ edit ]

In June 2020, Duda said that he would not allow gay couples to marry or adopt children, while describing the LGBT movement as ""a foreign ideology"" and comparing it to indoctrination in the Soviet Union. He also pledged he would ban LGBT teaching in schools.[48][49][50][51] In response to Duda's comments, former Prime Minister of Belgium Elio Di Rupo publicly asked the European Commission for an official reaction.[52][53][54] Soon after his comments, Duda invited presidential candidate Robert Biedroń (who had asked to meet the president)[55] and an LGBT activist, Bartosz Staszewski, to the Presidential Palace,[56][57] though Robert Biedroń eventually turned down the invitation, refusing to meet President Duda until he apologized.[58] According to Staszewski, during their meeting Duda cited freedom of speech to defend his words about ""LGBT ideology"".[56]

On 4 July 2020, Duda proposed changing the constitution to ban LGBT couples from adopting children. On 6 July 2020, he signed a document with a presidential draft of the amendment to the Polish Constitution.[59][60][61]

Foreign policy [ edit ]

Duda with Bulgarian President Rumen Radev in Sofia, on 27 November 2018

Duda was the first foreign leader to travel to the White House since the start of the COVID-19 pandemic. [ 62 ]

Duda with Brazilian President Jair Bolsonaro in New York, 21 September 2021

Andrzej Duda in Ukraine in April 2022

Duda with Italian President Sergio Mattarella in Rome, on 18 October 2022

Duda, Volodymyr Zelenskyy and Gitanas Nausėda held a meeting in the format of the Lublin Triangle in Lviv, Ukraine, 11 January 2023

In October 2017, he met with Turkish President Recep Tayyip Erdoğan and supported Turkey's accession to the European Union.[63]

U.S. President Donald Trump praised Duda, saying: ""He's doing a terrific job.""[64][65] In September 2019, Trump and Duda agreed to send 1,000 U.S. troops to Poland.[66]

On 24 June 2020, Trump said at a press conference with Duda that the United States planned to move some U.S. troops from Germany to Poland.[67][68] Trump said that ""Poland is one of the few countries that are fulfilling their obligations under NATO — in particular, their monetary obligations — and they asked us if we would send some additional troops. They're going to pay for that.""[69]

In February 2022, Duda attended the opening ceremony of the Olympic Winter Games in Beijing and met with Chinese President Xi Jinping. Some Polish diplomats criticised Duda's visit to China because some of Poland's Western allies boycotted the Winter Olympics in China due to the alleged Uyghur genocide and other human rights abuses in China.[70]

In October 2022, Duda declared that Poland would be willing to host U.S. nuclear weapons.[71]

In March 2023, Duda visited gas-rich Qatar and the United Arab Emirates. He focused on energy security and cooperation.[72]

On 7 October 2023, he condemned Hamas' actions during the Israel–Hamas war and expressed his support to Israel and its right to self-defense.[73]

On 9 January 2025, Duda asked Prime Minister Donald Tusk and his government to guarantee safe passage for Israeli Prime Minister Benjamin Netanyahu to travel to an event marking the 80th anniversary of the liberation of the Auschwitz concentration camp by Soviet troops, despite Netanyahu facing an arrest warrant from the International Criminal Court for Israeli war crimes in the Gaza war.[74] In response, Tusk guaranteed safe passage for Netanyahu.[75]

Lex Tusk [ edit ]

On 29 May 2023, during a press conference, Duda announced the intention to sign the ""Lex Tusk"", a law establishing a commission to investigate Russian influence in Poland. According to the law, the commission is expected to publish its first report in September before the parliamentary elections. The law reached the president's desk after the Sejm rejected the Senate's veto on the matter on 26 May. The Senate recommended the rejection of the law in its entirety due to its anti-democratic nature, numerous errors, and 13 potential violations of the constitution.[76][77] On 7 June 2023, the European Commission initiated legal proceedings against Poland regarding the extensively debated law. Brussels was concerned that the law might be used to target opposition politicians in the country's general election which was scheduled, and took place, in late 2023.[78][79]

Personal life [ edit ]

Duda is married to Agata Kornhauser-Duda, a teacher of German at Jan III Sobieski High School in Kraków.[80] They met as high school students, at a party.[3] The couple have been married since 21 December 1994.[81] They have one daughter named Kinga (b. 1995).[82] Duda's father-in-law is Julian Kornhauser, a well-known writer, translator and literary critic.[83]

Duda is a keen skier, and he participated in the Polish Academic Championships in Alpine skiing while he was a university student.[3]

Duda is a practising Roman Catholic. He took part in religious ceremonies on many occasions, including Midnight Mass, the blessing of food on Holy Saturday, and the Corpus Christi procession in Kraków.[84][85][86]

Honours [ edit ]

National honours [ edit ]

Foreign honours [ edit ]

Notes [ edit ]"
Andrzej Duda, Poland,en,https://www.weforum.org/people/andrzej-duda/,"1997, Master’s degree and 2005, Doctorate in Law, Department of Law and Administration, Jagiellonian University. 1997, started working as an academic teacher and scholar, Chair of Administrative Proceedings, and as of 2001, Chair of Administrative Law, Jagiellonian University. 2005, set up own law firm. August 2006, appointed Deputy Minister of Justice. 2007, elected to the Tribunal of the State by the Sejm. January 2008, appointed Undersecretary of State, Chancellery of the President. 2010, elected to the City Council of Krakow; concurrently, Chairman, Club of Law and Justice City Councillors. 2011, elected Deputy, Sejm; Deputy Chair, Committee for Constitutional Liability. 2014, Member of the European Parliament. Since August 2015, President of the Republic of Poland."
Andrzej Duda, Poland,en,https://apnews.com/hub/andrzej-duda,"The Associated Press is an independent global news organization dedicated to factual reporting. Founded in 1846, AP today remains the most trusted source of fast, accurate, unbiased news in all formats and the essential provider of the technology and services vital to the news business. More than half the world’s population sees AP journalism every day."
Andrzej Duda, Poland,en,https://www.europarl.europa.eu/meps/en/124899/ANDRZEJ_DUDA/history/8,RECOMMENDATION FOR SECOND READING on the Council position at first reading with a view to the adoption of a regulation of the European Parliament and of the Council amending Council Regulation (EC) No 515/97 on mutual assistance between the administrative authorities of the Member States and cooperation between the latter and the Commission to ensure the correct application of the law on customs and agricultural matters
Andrzej Duda, Poland,en,https://www.britannica.com/biography/Andrzej-Duda,"In May Andrzej Duda battled his way into a runoff election with Komorowski, which Duda then won. The woman who had guided Duda’s victorious campaign, Beata Szydło, was chosen to lead the PiS into the October election for the Sejm. She was poised to become prime minister…"
Andrzej Duda, Poland,en,https://nato-engages.org/speakers/andrzej-duda/,"Andrzej Sebastian Duda, was born on May 16, 1972 in Cracow. He is a Polish politician who serves as the sixth and current President of Republic of Poland, holding the office since 6 August 2015.

In 1997, President Duda defended his Master’s Thesis and started working as an academic teacher and scholar at the Chair of Administrative Proceedings, and as of 2001, the Chair of Administrative Law of the Jagiellonian University. In 2005, following the presentation of his dissertation “the Legal Interest in the Polish Administrative Law”, President Duda obtained a doctoral degree in law.

Before his tenure as President, from 2008 to 2010, during the presidency of the late Lech Kaczyński, Duda was an undersecretary of state in the Chancellery of the President of the Republic of Poland. In the 2011 parliamentary election, he received 79,981 votes for the Kraków constituency, as a candidate for the Law and Justice party, and became member of the Sejm (Parliament). In September 2013, the news weekly magazine Polityka commended President Duda for being one of the most active MPs, at the time, describing him as being open to opposition arguments and as refraining from personal attacks, as part of his role at the Commission for Constitutional Responsibility. President Duda remained a member of the Sejm until he was elected to the European Parliament in 2014.

Andrzej Duda was the presidential candidate for Law and Justice party, during the presidential election in May 2015. In the first round of voting, he received 5,179,092 votes – 34.76% of valid votes. In the second round of voting, he received 51.55% of the vote, winning with the incumbent president Bronisław Komorowski, who received 48.45% of the vote. On 26 May 2015, Duda resigned his party membership assuming the position of president-elect."
